"1712909","Huỳnh Quang Vinh","Công nghệ thông tin","2017","21/01/1999","Images/1712909.jpg","Tôi là một người vui tính","Thể thao: bóng đá, bóng bàn"
"1700001","Lê Văn A","Công nghệ sinh học","2018","22/02/2000","Images/1700001.jpg","Tôi là một người thân thiện"
"1700002","Trần Văn B","Môi trường","2017","04/05/1999","Images/1700002.jpg","Tôi là một người năng động","Thể thao: bóng rổ","Âm nhạc: Sam Smith","Phim: Titanic, Captain Phillips","Sách: Tôi đi code dạo, Trên đường băng","Nhạc cụ: Piano, Guitar"
"1700003","Nguyễn Thị C","Vật liệu","2017","09/03/1999","Images/1700003.jpg","Tôi là một người thông minh","Thể thao: cờ vua","Âm nhạc: Imagine Dragons"
"1700004","Lê Văn Hưu","Toán - tin","2017","02/04/1999","Images/1700004.jpg","Chào mọi người! Tôi bị gay","Bơi lội"
"9999999","Albert Einstein","Vật lí - vật lí kĩ thuật","1900","14/03/1879","Images/einstein.jpg","Everybody is a genius. But if you judge a fish by its ability to climb a tree, it would live its whole life believing that it is stupid.","Figuring stuff out"